{
  "schema_version": "0.2.0",
  "scenario_id": "handcheck_3x3_success",
  "description": "Synthetic 3-tile by 3-candidate handcheck scenario with feasible budget.",
  "budget_total_bytes": 210,
  "eta": 0.1,
  "lookup_profile_id": "handcheck_lookup_cap_v2",
  "tiles": [
    {
      "tile_id": "T1_near_important",
      "p_sal": 10,
      "visibility": 1,
      "screen_area": 1,
      "distance_norm": 1.0,
      "view_context": "full_body",
      "candidates": [
        {
          "candidate_id": "pdl_0_2",
          "pdl_ratio": 0.2,
          "file_format": "ply",
          "codec": "raw_ply",
          "codec_params": {},
          "asset_ref": "synthetic://handcheck_3x3/T1_near_important/pdl_0_2.ply",
          "q_base": 1,
          "r_bytes": 50,
          "d_ms": 1,
          "provenance": {
            "pdl_ratio": "synthetic",
            "q_base": "synthetic",
            "r_bytes": "synthetic",
            "d_ms": "synthetic",
            "asset_ref": "synthetic"
          }
        },
        {
          "candidate_id": "pdl_0_6",
          "pdl_ratio": 0.6,
          "file_format": "ply",
          "codec": "raw_ply",
          "codec_params": {},
          "asset_ref": "synthetic://handcheck_3x3/T1_near_important/pdl_0_6.ply",
          "q_base": 2,
          "r_bytes": 90,
          "d_ms": 2,
          "provenance": {
            "pdl_ratio": "synthetic",
            "q_base": "synthetic",
            "r_bytes": "synthetic",
            "d_ms": "synthetic",
            "asset_ref": "synthetic"
          }
        },
        {
          "candidate_id": "pdl_1_0",
          "pdl_ratio": 1.0,
          "file_format": "ply",
          "codec": "raw_ply",
          "codec_params": {},
          "asset_ref": "synthetic://handcheck_3x3/T1_near_important/pdl_1_0.ply",
          "q_base": 3,
          "r_bytes": 130,
          "d_ms": 3,
          "provenance": {
            "pdl_ratio": "synthetic",
            "q_base": "synthetic",
            "r_bytes": "synthetic",
            "d_ms": "synthetic",
            "asset_ref": "synthetic"
          }
        }
      ],
      "provenance": {
        "p_sal": "synthetic",
        "visibility": "synthetic",
        "screen_area": "synthetic",
        "distance_norm": "synthetic",
        "view_context": "synthetic"
      }
    },
    {
      "tile_id": "T2_mid_visible",
      "p_sal": 6,
      "visibility": 1,
      "screen_area": 1,
      "distance_norm": 3.0,
      "view_context": "full_body",
      "candidates": [
        {
          "candidate_id": "pdl_0_2",
          "pdl_ratio": 0.2,
          "file_format": "ply",
          "codec": "raw_ply",
          "codec_params": {},
          "asset_ref": "synthetic://handcheck_3x3/T2_mid_visible/pdl_0_2.ply",
          "q_base": 1,
          "r_bytes": 40,
          "d_ms": 1,
          "provenance": {
            "pdl_ratio": "synthetic",
            "q_base": "synthetic",
            "r_bytes": "synthetic",
            "d_ms": "synthetic",
            "asset_ref": "synthetic"
          }
        },
        {
          "candidate_id": "pdl_0_6",
          "pdl_ratio": 0.6,
          "file_format": "ply",
          "codec": "raw_ply",
          "codec_params": {},
          "asset_ref": "synthetic://handcheck_3x3/T2_mid_visible/pdl_0_6.ply",
          "q_base": 2,
          "r_bytes": 80,
          "d_ms": 2,
          "provenance": {
            "pdl_ratio": "synthetic",
            "q_base": "synthetic",
            "r_bytes": "synthetic",
            "d_ms": "synthetic",
            "asset_ref": "synthetic"
          }
        },
        {
          "candidate_id": "pdl_1_0",
          "pdl_ratio": 1.0,
          "file_format": "ply",
          "codec": "raw_ply",
          "codec_params": {},
          "asset_ref": "synthetic://handcheck_3x3/T2_mid_visible/pdl_1_0.ply",
          "q_base": 3,
          "r_bytes": 120,
          "d_ms": 3,
          "provenance": {
            "pdl_ratio": "synthetic",
            "q_base": "synthetic",
            "r_bytes": "synthetic",
            "d_ms": "synthetic",
            "asset_ref": "synthetic"
          }
        }
      ],
      "provenance": {
        "p_sal": "synthetic",
        "visibility": "synthetic",
        "screen_area": "synthetic",
        "distance_norm": "synthetic",
        "view_context": "synthetic"
      }
    },
    {
      "tile_id": "T3_far_capped",
      "p_sal": 4,
      "visibility": 1,
      "screen_area": 1,
      "distance_norm": 6.0,
      "view_context": "full_body",
      "candidates": [
        {
          "candidate_id": "pdl_0_2",
          "pdl_ratio": 0.2,
          "file_format": "ply",
          "codec": "raw_ply",
          "codec_params": {},
          "asset_ref": "synthetic://handcheck_3x3/T3_far_capped/pdl_0_2.ply",
          "q_base": 1,
          "r_bytes": 30,
          "d_ms": 1,
          "provenance": {
            "pdl_ratio": "synthetic",
            "q_base": "synthetic",
            "r_bytes": "synthetic",
            "d_ms": "synthetic",
            "asset_ref": "synthetic"
          }
        },
        {
          "candidate_id": "pdl_0_6",
          "pdl_ratio": 0.6,
          "file_format": "ply",
          "codec": "raw_ply",
          "codec_params": {},
          "asset_ref": "synthetic://handcheck_3x3/T3_far_capped/pdl_0_6.ply",
          "q_base": 2,
          "r_bytes": 70,
          "d_ms": 2,
          "provenance": {
            "pdl_ratio": "synthetic",
            "q_base": "synthetic",
            "r_bytes": "synthetic",
            "d_ms": "synthetic",
            "asset_ref": "synthetic"
          }
        },
        {
          "candidate_id": "pdl_1_0",
          "pdl_ratio": 1.0,
          "file_format": "ply",
          "codec": "raw_ply",
          "codec_params": {},
          "asset_ref": "synthetic://handcheck_3x3/T3_far_capped/pdl_1_0.ply",
          "q_base": 3,
          "r_bytes": 110,
          "d_ms": 3,
          "provenance": {
            "pdl_ratio": "synthetic",
            "q_base": "synthetic",
            "r_bytes": "synthetic",
            "d_ms": "synthetic",
            "asset_ref": "synthetic"
          }
        }
      ],
      "provenance": {
        "p_sal": "synthetic",
        "visibility": "synthetic",
        "screen_area": "synthetic",
        "distance_norm": "synthetic",
        "view_context": "synthetic"
      }
    }
  ],
  "provenance_summary": {
    "default_type": "synthetic",
    "source_ids": [
      "handcheck_3x3_manual"
    ],
    "notes": "Synthetic generic-candidate handcheck fixture for Stage2 schema and solver checks. Not real Longdress experiment data."
  }
}
